asset_id,submitter_id,nacc_id,index,asset_type_id,asset_type_other,asset_name,date_acquiring_type_id,acquiring_date,acquiring_month,acquiring_year,date_ending_type_id,ending_date,ending_month,ending_year,asset_acquisition_type_id,valuation,owner_by_submitter,owner_by_spouse,owner_by_child,latest_submitted_date
2616,40,62,1,36,,โฉนดที่ดิน,1,26,9,2011,4,,,,6,10080000,FALSE,FALSE,TRUE,2022-12-13
2617,40,62,2,36,,โฉนดที่ดิน,1,,,,4,,,,6,10080000,FALSE,FALSE,TRUE,2022-12-13
2618,40,62,3,1,,โฉนดที่ดิน,1,6,7,2012,4,,,,6,10080000,FALSE,FALSE,TRUE,2022-12-13
2619,40,62,4,36,,โฉนดที่ดิน,1,25,3,2005,4,,,,6,1837500,FALSE,FALSE,TRUE,2022-12-13
2620,40,62,5,36,,โฉนดที่ดิน,1,,,,4,,,,6,2925000,TRUE,FALSE,FALSE,2022-12-13
2621,40,62,6,36,,โฉนดที่ดิน,1,16,10,2018,4,,,,6,104000000,FALSE,FALSE,TRUE,2022-12-13
2622,40,62,7,36,,โฉนด,1,10,6,2022,4,,,,6,10640000,TRUE,FALSE,FALSE,2022-12-13
2623,40,62,1,13,,เพนท์เฮ้าส์,1,20,12,2010,4,,,,6,16500000,TRUE,FALSE,FALSE,2022-12-13
2624,40,62,2,37,,สิ่งปลูกสร้าง,1,6,7,2011,4,,,,6,630000,TRUE,FALSE,FALSE,2022-12-13
2625,40,62,3,37,,สิ่งปลูกสร้าง,1,10,10,2013,4,,,,6,2076460,TRUE,FALSE,FALSE,2022-12-13
2626,40,62,4,10,,ห้องชุด,1,16,10,2018,4,,,,6,656180,FALSE,FALSE,TRUE,2022-12-13
2627,40,62,5,37,ทาวน์เฮ้าส์,สิ่งปลูกสร้าง,1,10,6,2022,4,,,,6,580440,TRUE,FALSE,FALSE,2022-12-13
2628,40,62,1,38,,ยานพาหนะ,1,29,8,2013,4,,,,6,18900,TRUE,FALSE,FALSE,2022-12-13
2629,40,62,2,38,,ยานพาหนะ,1,2,4,2019,4,,,,6,2800000,TRUE,FALSE,FALSE,2022-12-13
2630,40,62,3,38,,ยานพาหนะ,1,10,10,2014,4,,,,6,2150000,TRUE,FALSE,FALSE,2022-12-13
2631,40,62,4,38,,ยานพาหนะ,1,21,2,2019,4,,,,6,2280000,FALSE,TRUE,FALSE,2022-12-13
2632,40,62,5,38,,ยานพาหนะ,1,11,10,2019,4,,,,6,2068000,TRUE,FALSE,FALSE,2022-12-13
2633,40,62,6,38,,ยานพาหนะ,1,24,4,2021,4,,,,6,5500000,FALSE,TRUE,FALSE,2022-12-13
2634,40,62,1,22,,กรมธรรม์,1,26,6,2008,1,,,,6,245098.88,TRUE,FALSE,FALSE,2022-12-13
2635,40,62,2,22,,T142753985 บริษัท เอไอเอ จำกัด สิทธิในกรมธรรม์ประกันภัย เลขที่,1,2,9,2045,1,,,,6,196151.85,TRUE,FALSE,FALSE,2022-12-13
2636,40,62,3,22,,T144092495 บริษัท เอไอเอ จำกัด สิทธิในกรมธรรม์ประกันภัย เลขที่,1,,,,1,,,,6,238702.78,TRUE,FALSE,FALSE,2022-12-13
2637,40,62,4,22,,T144092466 บริษัท เอไอเอ จำกัด สิทธิในกรมธรรม์ประกันภัย,1,3,4,2027,1,,,,6,335532.86,TRUE,FALSE,FALSE,2022-12-13
2638,40,62,5,24,,สมาชิก,1,,,,1,,,,6,4659813.7,TRUE,FALSE,FALSE,2022-12-13
2639,40,62,6,26,,สำนักงานเลขาธิการสภาผู้แทนราษฎร เงินสงเคราะห์ชราภาพมาตรา 33/39,1,16,8,2022,1,,,,6,702000,TRUE,FALSE,FALSE,2022-12-13
2640,40,62,7,24,,สำนักงานประกันสังคม สิทธิในสมาชิก แปซิฟิค คลับ ซิตี้,1,,,2019,1,,,,6,110667,TRUE,FALSE,FALSE,2022-12-13
2641,40,62,8,22,,หมายเลขสมาชิก W0167 สิทธิในกรมธรรม์ประกันภัย เลขที่,1,,,,1,,,,6,480966.88,TRUE,FALSE,FALSE,2022-12-13
2642,40,62,9,22,,T126026146 บริษัท เอไอเอ จำกัด สิทธิในกรมธรรม์ประกันภัย,1,28,9,2007,1,,,,6,290.4,TRUE,FALSE,FALSE,2022-12-13
2643,40,62,10,22,,เลขที่ T134233497 บริษัท เอไอเอ จำกัด สิทธิในกรมธรรม์ประกันภัย เลขที่ 4403184,1,23,11,2005,1,,,,6,243631.78,FALSE,FALSE,TRUE,2022-12-13
2644,40,62,11,22,,บริษัท เอฟดับบลิวดี ประกันชีวิต จำกัด,1,19,12,2008,1,,,,6,1964383.56,TRUE,FALSE,FALSE,2022-12-13
2645,40,62,12,22,,บริษัท เอฟดับบลิวดี ประกันชีวิต จำกัด (มหาชน) สิทธิในกรมธรรม์ประกันภัย,1,22,11,2033,1,,,,6,99082.62,TRUE,FALSE,FALSE,2022-12-13
2646,40,62,13,26,,เงินสงเคราะห์,1,30,9,2024,1,,,,6,3658602.74,TRUE,FALSE,FALSE,2022-12-13
2647,40,62,14,22,,สำนักงานประกันสังคม สิทธิในกรมธรรม์ประกันภัย,1,13,9,2022,1,,,,6,123442.78,TRUE,FALSE,FALSE,2022-12-13
2648,40,62,15,22,,เลขที่ T154160922 บริษัท เอไอเอ จำกัด สิทธิในกรมธรรม์ประกันภัย เลขที่,1,25,2,2036,1,,,,6,215392.59,FALSE,TRUE,FALSE,2022-12-13
2649,40,62,16,22,,T173893157 บริษัท เอไอเอ จำกัด สิทธิในกรมธรรม์ประกันภัย,1,6,7,2089,1,,,,6,106827.97,FALSE,TRUE,FALSE,2022-12-13
2650,40,62,17,22,,กรมธรรม์,1,25,11,2023,1,,,,6,1891309.59,FALSE,FALSE,TRUE,2022-12-13
2651,40,62,18,22,,เลขที่ T164870325 บริษัท เอไอเอ จำกัด สิทธิในกรมธรรม์ประกันภัย เลขที่ 40481424,1,23,5,2036,1,,,,6,210368.49,FALSE,FALSE,TRUE,2022-12-13
2652,40,62,19,22,,บริษัท เอฟดับบลิวดี ประกันชีวิต จำกัด (มหาชน) สิทธิ์ในกรรมธรรม์ประกันภัย,1,30,10,2033,1,,,,6,284251.78,FALSE,FALSE,TRUE,2022-12-13
2653,40,62,20,39,,สิทธิและสัมปทาน,1,27,12,2010,1,,,,6,906466.75,FALSE,FALSE,TRUE,2022-12-13
2654,40,62,1,28,,หมวดกระเป๋า กระเป๋า Hermes รุ่น Himalayan Birkin,2,,,,4,,,,6,3100000,TRUE,FALSE,FALSE,2022-12-13
2655,40,62,2,28,,กระเป๋า Hermes รุ่น Kelly Size 32 สี Electra blue,2,,,,4,,,,6,465900,FALSE,FALSE,TRUE,2022-12-13
2656,40,62,3,28,,กระเป๋า Hermes รุ่น Kelly Size 32 สี Rose Lipstick,2,,,,4,,,,6,575000,TRUE,FALSE,FALSE,2022-12-13
2657,40,62,4,28,,กระเป๋า Hermes รุ่น Kelly Size 32 สี Black,2,,,,4,,,,6,496952,TRUE,FALSE,FALSE,2022-12-13
2658,40,62,5,28,,กระเป๋า Hermes รุ่น Kelly Size 28 สี Natural,2,,,,4,,,,6,400000,FALSE,FALSE,TRUE,2022-12-13
2659,40,62,6,28,,กระเป๋า Hermes รุ่น Birkin Size 25 สี Etoupe,2,,,,4,,,,6,400000,TRUE,FALSE,FALSE,2022-12-13
2660,40,62,7,28,,กระเป๋า Hermes รุ่น Toolbox สีน้ำตาล,2,,,,4,,,,6,140000,TRUE,FALSE,FALSE,2022-12-13
2661,40,62,8,28,,กระเป๋า Hermes รุ่น Jypsiere สีน้ำตาล,2,,,,4,,,,6,119000,TRUE,FALSE,FALSE,2022-12-13
2662,40,62,9,28,,กระเป๋า Hermes รุ่น Birkin Size 30 สีเทา,2,,,,4,,,,6,300000,TRUE,FALSE,FALSE,2022-12-13
2663,40,62,10,28,,กระเป๋า Hermes รุ่น Kelly Size 32 สีส้ม,2,,,,4,,,,6,200000,TRUE,FALSE,FALSE,2022-12-13
2664,40,62,11,28,,กระเป๋า Hermes รุ่น Lindy สีน้ำเงิน,2,,,,4,,,,6,170000,TRUE,FALSE,FALSE,2022-12-13
2665,40,62,12,28,,กระเป๋า Hermes รุ่น Kelly Size 28 สี Indigo Blue,2,,,,4,,,,6,359000,TRUE,FALSE,FALSE,2022-12-13
2666,40,62,13,28,,กระเป๋า Hermes รุ่น Everlyn สีชมพู,2,,,,4,,,,6,62900,FALSE,FALSE,TRUE,2022-12-13
2667,40,62,14,28,,กระเป๋า Chanel รุ่น Classic Size Jumbo สี Beige,1,,,2011,4,,,,6,190790,FALSE,FALSE,TRUE,2022-12-13
2668,40,62,15,28,,กระเป๋า Chanel รุ่น Classic Size Jumbo สี Black,1,,,2009,4,,,,6,190790,FALSE,FALSE,TRUE,2022-12-13
2669,40,62,16,28,,กระเป๋า Chanel รุ่น Classic Size 10 สี Red,1,,,2012,4,,,,6,119650,TRUE,FALSE,FALSE,2022-12-13
2670,40,62,17,28,,กระเป๋า Chanel รุ่น Reissue สี Champagne,1,,,2013,4,,,,6,179000,TRUE,FALSE,FALSE,2022-12-13
2671,40,62,18,28,,กระเป๋า Chanel รุ่น Reissue Roll Clutch lambskin,2,,,,4,,,,6,82500,TRUE,FALSE,FALSE,2022-12-13
2672,40,62,19,28,,กระเป๋า Givenchy รุ่น Pandora,1,,,2018,4,,,,6,69000,TRUE,FALSE,FALSE,2022-12-13
2673,40,62,20,28,,กระเป๋า Givenchy รุ่น GV3 ไซส์ Medium สีดำ,1,,,2018,4,,,,6,88000,TRUE,FALSE,FALSE,2022-12-13
2674,40,62,21,28,,กระเป๋า Valentino รุ่น Medium Rockstud,2,,,,4,,,,6,83390,FALSE,FALSE,TRUE,2022-12-13
2675,40,62,22,28,,Crossbody กระเป๋า Valentino รุ่น Rockstud หนัง,2,,,,4,,,,6,120000,FALSE,FALSE,TRUE,2022-12-13
2676,40,62,23,28,,กระเป๋า Celine รุ่น Box Stingray Exotic,1,,,2015,4,,,,6,160000,TRUE,FALSE,FALSE,2022-12-13
2677,40,62,24,28,,กระเป๋า Celine รุ่น Tie สีน้ำเงิน,1,,,2016,4,,,,6,120000,TRUE,FALSE,FALSE,2022-12-13
2678,40,62,25,28,,กระเป๋า Boyy รุ่น Bobby ไซส์ 23 หนังงู,1,,,2018,4,,,,6,58000,TRUE,FALSE,FALSE,2022-12-13
2679,40,62,26,28,,กระเป๋า Boyy รุ่น Karl Leopard,1,,,2018,4,,,,6,37200,TRUE,FALSE,FALSE,2022-12-13
2680,40,62,27,28,,กระเป๋า Balenciaga รุ่น Riva City สี Cognac,2,,,,4,,,,6,73500,TRUE,FALSE,FALSE,2022-12-13
2681,40,62,28,28,,กระเป๋า Fendi รุ่น Peekaboo Iconic,1,,,2018,4,,,,6,165550,FALSE,FALSE,TRUE,2022-12-13
2682,40,62,29,28,,Essential กระเป๋า Bottega Veneta รุ่น Intrecciato Calf Roma สี China Red,2,,,,4,,,,6,193390,FALSE,FALSE,TRUE,2022-12-13
2683,40,62,30,30,,กระเป๋า Christian Dior รุ่น zippy หนัง งู หมวดนาฬิกา,1,,,2017,4,,,,6,100000,FALSE,FALSE,TRUE,2022-12-13
2684,40,62,31,30,,นาฬิกา Patek Philippe,2,,,,4,,,,6,1089000,TRUE,FALSE,FALSE,2022-12-13
2685,40,62,32,30,,นาฬิกา Panerai,2,,,,4,,,,6,175400,TRUE,FALSE,FALSE,2022-12-13
2686,40,62,33,30,,นาฬิกา Rolex รุ่น Daytona สี Rose Gold,2,,,,4,,,,6,1017000,TRUE,FALSE,FALSE,2022-12-13
2687,40,62,34,30,,นาฬิกา Rolex รุ่น Oyster Perpetual,1,,,2013,4,,,,6,300000,TRUE,FALSE,FALSE,2022-12-13
2688,40,62,35,30,,นาฬิกา Rolex รุ่น Oyster Perpetual,1,,,2015,4,,,,6,330000,FALSE,FALSE,TRUE,2022-12-13
2689,40,62,36,30,,นาฬิกา Rolex รุ่น Oyster Perpetual,1,,,2017,4,,,,6,275000,TRUE,FALSE,FALSE,2022-12-13
2690,40,62,37,30,,นาฬิกา Hublot,1,,,2015,4,,,,6,500000,TRUE,FALSE,FALSE,2022-12-13
2691,40,62,38,30,,นาฬิกา Breguet,2,,,,4,,,,6,2221000,TRUE,FALSE,FALSE,2022-12-13
2692,40,62,39,30,,นาฬิกา Penerai,2,,,,4,,,,6,180000,TRUE,FALSE,FALSE,2022-12-13
2693,40,62,40,30,,นาฬิกา Omega Speedmaster,1,,,2013,4,,,,6,150000,TRUE,FALSE,FALSE,2022-12-13
2694,40,62,41,30,,นาฬิกา Rolex GMT-MASTER II,1,,,2017,4,,,,6,500000,TRUE,FALSE,FALSE,2022-12-13
2695,40,62,42,31,,หมวด Jewelry แหวนเพชร 1.5 กะรัต,1,,,2008,4,,,,6,730000,TRUE,FALSE,FALSE,2022-12-13
2696,40,62,43,31,,แหวนเพชร,1,,,2011,4,,,,6,350000,TRUE,FALSE,FALSE,2022-12-13
2697,40,62,44,31,,แหวนเพชร,1,,,2012,4,,,,6,50000,FALSE,FALSE,TRUE,2022-12-13
2698,40,62,45,35,,กำไลข้อมือ Catier รุ่น Love,1,,,2015,4,,,,6,323200,TRUE,FALSE,FALSE,2022-12-13
2699,40,62,46,31,,แหวน Catier รุ่น Paris Nouvelle Vague,1,,,2016,4,,,,6,240000,TRUE,FALSE,FALSE,2022-12-13
2700,40,62,47,31,,สร้อยเพชรพร้อมจี้เพชรรูปหัวใจ,2,,,,4,,,,6,200000,TRUE,FALSE,FALSE,2022-12-13
2701,40,62,48,31,,แหวนทับทิม,2,,,,4,,,,6,20000,FALSE,FALSE,TRUE,2022-12-13
2702,40,62,49,31,,แหวนมรกต,2,,,,4,,,,6,100000,FALSE,FALSE,TRUE,2022-12-13
2703,40,62,50,35,,ต่างหูมรกต 1 คู่,2,,,,4,,,,6,200000,FALSE,FALSE,TRUE,2022-12-13
2704,40,62,51,31,,แหวนเพชร 0.3 กะรัต,2,,,,4,,,,6,19000,TRUE,FALSE,FALSE,2022-12-13
2705,40,62,52,31,,แหวนเพชรทรงกลม ขนาด 1.2 กะรัต,2,,,,4,,,,6,466000,TRUE,FALSE,FALSE,2022-12-13
2706,40,62,53,31,,แหวนเพชรรูปดอกไม้เรือนทองคำ,2,,,,4,,,,6,20000,TRUE,FALSE,FALSE,2022-12-13
2707,40,62,54,31,,แหวนประดับมุก,2,,,,4,,,,6,15000,TRUE,FALSE,FALSE,2022-12-13
2708,40,62,55,31,,เพชร น้ำหนัก 0.91 กะรัต (G),2,,,,4,,,,6,91000,TRUE,FALSE,FALSE,2022-12-13
2709,40,62,56,31,,เพชร น้ำหนัก 0.91 กะรัต (G),2,,,,4,,,,6,91000,TRUE,FALSE,FALSE,2022-12-13
2710,40,62,57,35,,สร้อยคอไข่มุก MIKIMOTO,2,,,,4,,,,6,180000,TRUE,FALSE,FALSE,2022-12-13
2711,40,62,58,35,,สร้อยคอไข่มุก MIKIMOTO,1,,,2014,4,,,,6,860000,TRUE,FALSE,FALSE,2022-12-13
2712,40,62,59,31,,ต่างหูผึ้ง ปีกเพชร 1 คู่,2,,,,4,,,,6,15000,TRUE,FALSE,FALSE,2022-12-13
2713,40,62,60,31,,ต่างหูเพชร,2,,,,4,,,,6,250000,FALSE,FALSE,TRUE,2022-12-13
2714,40,62,61,31,,ต่างหูเพชร ตัวเรือนทองคำขาว,1,,,2008,4,,,,6,59000,TRUE,FALSE,FALSE,2022-12-13
2715,40,62,62,31,,เพชร น้ำหนัก 0.83 กะรัต (E),1,,,2017,4,,,,6,2560,TRUE,FALSE,FALSE,2022-12-13
2716,40,62,63,35,,กำไลหยก,2,,,,4,,,,6,20000,TRUE,FALSE,FALSE,2022-12-13
2717,40,62,64,35,,. สร้อยไข่มุกดำ,2,,,,4,,,,6,150000,TRUE,FALSE,FALSE,2022-12-13
2718,40,62,65,35,,สร้อยไข่มุก,2,,,,4,,,,6,30000,TRUE,FALSE,FALSE,2022-12-13
2719,40,62,66,35,,สร้อยไข่มุกเล็ก,2,,,,4,,,,6,45000,TRUE,FALSE,FALSE,2022-12-13
2720,40,62,67,31,,จี้หยกล้อมเพชร,2,,,,4,,,,6,45000,TRUE,FALSE,FALSE,2022-12-13
2721,40,62,68,31,,ชุดหยกล้อมเพชร,2,,,,4,,,,6,50000,TRUE,FALSE,FALSE,2022-12-13
2722,40,62,69,31,,ต่างหูเพชร,2,,,,4,,,,6,20000,TRUE,FALSE,FALSE,2022-12-13
2723,40,62,70,31,,แหวนเพชร,2,,,,4,,,,6,90000,TRUE,FALSE,FALSE,2022-12-13
2724,40,62,71,31,,ชุดเครื่องเพชร,2,,,,4,,,,6,300000,TRUE,FALSE,FALSE,2022-12-13
2725,40,62,72,31,,แหวนบุษราคัม,2,,,,4,,,,6,25000,TRUE,FALSE,FALSE,2022-12-13
2726,40,62,73,31,,แหวนทองประดับเพชร,2,,,,4,,,,6,40000,TRUE,FALSE,FALSE,2022-12-13
2727,40,62,74,33,,ทองคำรูปพรรณกึ่งจิวเวอร์รี่,2,,,,4,,,,6,385500,TRUE,FALSE,FALSE,2022-12-13
2728,40,62,75,32,,ทองคำแท่ง น้ำหนักรวม 31 บาท หมวดพระเครื่อง,2,,,,4,,,,6,614420,TRUE,FALSE,FALSE,2022-12-13
2729,40,62,76,31,,พระเครื่อง หลวงพ่อแก้ว วัดเครือวัลย์ พิมพ์กลาง 1 พร้อมกรอบทองล้อมเพชร,2,,,,4,,,,6,18150000,TRUE,FALSE,FALSE,2022-12-13
2730,40,62,77,31,,พระเครื่อง สมเด็จ วัดระฆัง พิมพ์ใหญ่ พร้อม กรอบทองล้อมเพชร,2,,,,4,,,,6,45200000,FALSE,FALSE,TRUE,2022-12-13
2731,40,62,78,31,,พระเครื่อง พลวงพ่อแก้ว วัดเครือวัลย์ พิมพ์กลาง 2 พร้อมกรอบทองล้อมเพชร,2,,,,4,,,,6,12150000,TRUE,FALSE,FALSE,2022-12-13
2732,40,62,79,32,,พระเครื่อง ซุ้มกอ,2,,,,4,,,,6,10000000,FALSE,FALSE,TRUE,2022-12-13
2733,40,62,80,31,,พระเครื่อง หลวงพ่อคลีพ วัดสมถะ จังหวัดชลบุรี พร้อมกรอบทองล้อมเพชร,2,,,,4,,,,6,1650000,TRUE,FALSE,FALSE,2022-12-13
2734,40,62,81,31,,พระเครื่อง เหรียญวัดพนัญเชิง พร้อมกรอบทอง ล้อมเพชร,2,,,,4,,,,6,1150000,FALSE,FALSE,TRUE,2022-12-13
2735,40,62,82,32,,พระเครื่อง หลวงปู่ทวดเนื้อว่าน วัดช้างไห้,2,,,,4,,,,6,1000000,TRUE,FALSE,FALSE,2022-12-13
2736,40,62,83,32,,พระเครื่อง หลวงปู่ทวด วัดช้างไห้ พิมพ์กลาง ไม่ปั้มซ้ำ,2,,,,4,,,,6,1500000,TRUE,FALSE,FALSE,2022-12-13
2737,40,62,84,31,,พระเครื่อง หลวงพ่อแก้ว วัดเครือวัลย์ พิมพ์จิ๋ว พร้อมกรอบทองล้อมเพชร,2,,,,4,,,,6,2100000,TRUE,FALSE,FALSE,2022-12-13
2738,40,62,85,32,,พระพุทธรูปปางลีลา สุโขทัย,2,,,,4,,,,6,8000000,TRUE,FALSE,FALSE,2022-12-13
2739,40,62,86,32,,พระพุทธรูป อู่ทอง หน้าหนุ่ม,2,,,,4,,,,6,20000000,TRUE,FALSE,FALSE,2022-12-13
2740,40,62,87,32,,พระลีลากำแพงศอก กรุวัดพระศรีรัตนมหาธาตุ จังหวัดสุพรรณบุรี,1,,,2015,4,,,,6,2500000,TRUE,FALSE,FALSE,2022-12-13
2741,40,62,88,35,,องค์จตุคาม รุ่นปี 2530,1,,,2004,4,,,,6,200000,TRUE,FALSE,FALSE,2022-12-13
2742,40,62,89,35,,สมเด็จวัดเกศไชโย พิมพ์นิยม ฐาน 7 ชั้น หมวด Jewelry (เพิ่มเติม),2,,,,4,,,,6,2000000,TRUE,FALSE,FALSE,2022-12-13
2743,40,62,90,35,,กำไล Cartier,1,5,6,2022,4,,,,6,353000,TRUE,FALSE,FALSE,2022-12-13
2744,40,62,91,35,,สร้อยคอ TIFFANY&CO,1,10,6,2022,4,,,,6,505000,TRUE,FALSE,FALSE,2022-12-13
2745,80,63,1,1,,โฉนด,1,9,7,2014,4,,,,6,200000,TRUE,FALSE,FALSE,2022-12-13
2746,80,63,2,36,,โฉนด,1,21,6,2019,4,,,,6,2000000,TRUE,FALSE,FALSE,2022-12-13
2747,80,63,3,1,,โฉนด,1,17,2,1994,4,,,,6,4000000,TRUE,FALSE,FALSE,2022-12-13
2748,80,63,4,1,,โฉนด,1,22,6,2009,4,,,,6,3300000,TRUE,FALSE,FALSE,2022-12-13
2749,80,63,5,1,,โฉนด,1,15,9,2015,4,,,,6,3300000,TRUE,FALSE,FALSE,2022-12-13
2750,80,63,6,1,,โฉนด,1,15,9,2015,4,,,,6,4980000,TRUE,FALSE,FALSE,2022-12-13
2751,80,63,7,1,,โฉนด,1,14,11,2018,4,,,,6,5040000,TRUE,FALSE,FALSE,2022-12-13
2752,80,63,1,38,,ยานพาหนะ,1,20,5,2015,4,,,,6,300000,TRUE,FALSE,FALSE,2022-12-13
2753,80,63,2,38,,ยานพาหนะ,1,20,12,2017,4,,,,6,200000,TRUE,FALSE,FALSE,2022-12-13
2754,80,63,3,38,,ยานพาหนะ,1,18,1,2021,4,,,,6,1119660,TRUE,FALSE,FALSE,2022-12-13
2755,80,63,1,22,,T00359831 กรมธรรม์ประกันภัยเลขที่,1,17,4,2048,1,,,,6,252498.38,TRUE,FALSE,FALSE,2022-12-13
2756,80,63,2,22,,T01816006 กรมธรรม์ประกันภัยเลขที่,1,11,11,2047,1,,,,6,371359.51,TRUE,FALSE,FALSE,2022-12-13
2757,80,63,3,22,,T04692496 กรมธรรม์ประกันภัยเลขที่,1,7,6,2032,1,,,,6,517200,TRUE,FALSE,FALSE,2022-12-13
2758,80,63,4,22,,TO5339808 กรมธรรม์ประกันภัยเลขที่,1,26,6,2026,1,,,,6,274800,TRUE,FALSE,FALSE,2022-12-13
2759,80,63,5,22,,T123790802 กรมธรรม์ประกันภัยเลขที่,1,27,2,2031,1,,,,6,292150,TRUE,FALSE,FALSE,2022-12-13
2760,80,63,1,32,,จำนวนหน่วย 7 บาท กับ สร้อยคอทองคำ 2 เส้น (7 บาท) 9 องค์ พร้อมพระเลี่ยมทอง 9 องค์,2,,,,4,,,,6,170000,TRUE,FALSE,FALSE,2022-12-13
2761,80,63,2,32,,9 องค์ พระเครื่องและเหรียญเลี่ยมทองคำ,2,,,,4,,,,6,50000,TRUE,FALSE,FALSE,2022-12-13
2762,80,63,3,31,,3 วง แหวนเพชร,2,,,,4,,,,6,90000,TRUE,FALSE,FALSE,2022-12-13
2763,80,63,4,30,,1 เรือน นาฬิกา ROLEX,2,,,,4,,,,6,80000,TRUE,FALSE,FALSE,2022-12-13
2764,80,63,5,30,,1 เรือน นาฬิกา CITIZEN,2,,,,4,,,,6,8000,TRUE,FALSE,FALSE,2022-12-13
2765,80,63,6,35,,สร้อยคอพร้อมต่างหูมุก 1 ชุด,2,,,,4,,,,6,50000,TRUE,FALSE,FALSE,2022-12-13
2766,80,63,7,31,,สร้อยคอทองคำพร้อมไพลินล้อมเพชร 1 ชุด สร้อยข้อมือ และต่างหูเพชร,2,,,,4,,,,6,30000,TRUE,FALSE,FALSE,2022-12-13
2767,80,63,8,31,,วง แหวนเพชร,2,,,,4,,,,6,100000,TRUE,FALSE,FALSE,2022-12-13
2768,80,63,9,31,,1 วง แหวนมุกล้อมเพชร,2,,,,4,,,,6,25000,TRUE,FALSE,FALSE,2022-12-13
2769,80,63,10,31,,ต่างหูเพชร 2 คู,2,,,,4,,,,6,65000,TRUE,FALSE,FALSE,2022-12-13
2770,80,63,11,33,,สร้อยข้อมือทองคำ 3 เส้น 2.5 บาท,2,,,,4,,,,6,50000,TRUE,FALSE,FALSE,2022-12-13
2771,80,63,12,33,,3 บาท สร้อยคอทองคำ 5 เส้น,2,,,,4,,,,6,60000,TRUE,FALSE,FALSE,2022-12-13
2772,80,63,13,33,,ทองคำแท่ง 2 แท่ง 15 บาท,2,,,,4,,,,6,300000,TRUE,FALSE,FALSE,2022-12-13
2773,41,168,1,1,,โฉนด,1,1,9,2016,4,,,,6,595200,TRUE,FALSE,FALSE,2022-12-29
2774,41,168,2,36,,โฉนด,1,,,,4,,,,6,8100000,TRUE,FALSE,FALSE,2022-12-29
2775,41,168,3,1,,โฉนด,1,21,2,2019,4,,,,6,1840400,TRUE,FALSE,FALSE,2022-12-29
2776,41,168,4,1,,(โฉนด 18443 มีชื่อรวม 3 คน),1,20,11,2003,4,,,,6,1258666.67,TRUE,FALSE,FALSE,2022-12-29
2777,41,168,1,12,,ตึก,1,20,11,2003,4,,,,6,15192000,TRUE,FALSE,FALSE,2022-12-29
2778,41,168,1,38,,ยานพาหนะ,1,2,11,2010,4,,,,6,200000,TRUE,FALSE,FALSE,2022-12-29
2779,41,168,2,38,,ยานพาหนะ,1,20,5,2017,4,,,,6,2900000,TRUE,FALSE,FALSE,2022-12-29
2780,41,168,1,22,,กรมธรรม์ AIA เลขที่ T101494777,1,19,11,2002,1,,,,6,4294075.34,TRUE,FALSE,FALSE,2022-12-29
2781,41,168,2,22,,กรมธรรม์ AIA เลขที่ T126050183,1,28,9,2006,1,,,,6,494687.21,TRUE,FALSE,FALSE,2022-12-29
2782,41,168,3,22,,กรมธรรม์ AIA เลขที่ T177162729,1,,,,1,,,,6,51656.88,TRUE,FALSE,FALSE,2022-12-29
2783,41,168,4,22,,กรมธรรม์ AIA เลขที่ T400007425,1,19,12,2018,1,,,,6,304395.23,TRUE,FALSE,FALSE,2022-12-29
2784,41,168,5,22,,กรมธรรม์ AIA เลขที่ T121547316,1,27,11,2005,1,,,,6,169831.67,TRUE,FALSE,FALSE,2022-12-29
2785,41,168,6,22,,กรมธรรม์ AIA เลขที่ T136455901,1,29,4,2050,1,,,,6,414632.28,TRUE,FALSE,FALSE,2022-12-29
2786,41,168,7,22,,,1,1,5,2069,1,,,,6,50000,TRUE,FALSE,FALSE,2022-12-29
2787,41,168,1,33,,ทองคำแท่ง (น้ำหนักรวม 100 บาท),2,,,,4,,,,6,2900000,TRUE,FALSE,FALSE,2022-12-29
2788,41,168,2,30,,นาฬิกาข้อมือ,2,,,,4,,,,6,100000,TRUE,FALSE,FALSE,2022-12-29
2789,41,168,3,30,,นาฬิกา ปาเต๊ะ ฟิลลิป,2,,,,4,,,,6,700000,TRUE,FALSE,FALSE,2022-12-29
2790,41,168,4,29,,อาวุธปืน ขนาด 9 มม. ยี่ห้อเลสแบร์,2,,,,4,,,,6,90000,TRUE,FALSE,FALSE,2022-12-29
2791,41,168,5,29,,อาวุธปืน ขนาด .45 ยี่ห้อเอสทีไอ,2,,,,4,,,,6,95000,TRUE,FALSE,FALSE,2022-12-29
2792,41,168,6,29,,อาวุธปืน ขนาด 9 มม. ยี่ห้อซิกซาวเออร์,2,,,,4,,,,6,30000,TRUE,FALSE,FALSE,2022-12-29
2793,41,168,7,29,,อาวุธปืนลูกซองยาว (เดี่ยวลูกซอง),2,,,,4,,,,6,20000,TRUE,FALSE,FALSE,2022-12-29
2794,41,168,8,29,,อาวุธปืน ขนาด .380 ยี่ห้อรูเกอร์,2,,,,4,,,,6,45000,TRUE,FALSE,FALSE,2022-12-29
2795,41,168,9,29,,อาวุธปืน ขนาด 9 มม. ยี่ห้อซิกซาวเออร์,2,,,,4,,,,6,23800,TRUE,FALSE,FALSE,2022-12-29
2796,41,168,10,32,,พระเครื่องเลี่ยมทอง,2,,,,4,,,,6,103500,TRUE,FALSE,FALSE,2022-12-29
2797,41,168,11,29,,อาวุธปืน ขนาด 9 มม. ยี่ห้อกล็อก,2,,,,4,,,,6,40000,TRUE,FALSE,FALSE,2022-12-29
2798,41,168,12,29,,อาวุธปืน ขนาด .45 มม. ยี่ห้อโคลท์,2,,,,4,,,,6,75000,TRUE,FALSE,FALSE,2022-12-29
2799,41,168,13,29,,อาวุธปืนยาว ขนาด .22 ยี่ห้อ KIDD,2,,,,4,,,,6,50000,TRUE,FALSE,FALSE,2022-12-29
2800,41,168,14,29,,อาวุธปืน ขนาด .45 ยี่ห้อวิลสันคอมแบ็ต,2,,,,4,,,,6,250000,TRUE,FALSE,FALSE,2022-12-29
2801,41,168,15,29,,อาวุธปืน ขนาด 9 มม. ยี่ห้อ ZEV (OZ9),2,,,,4,,,,6,85000,TRUE,FALSE,FALSE,2022-12-29
2802,41,168,16,29,,อาวุธปืน ขนาด 9 มม. ยี่ห้อซิกซาวเออร์,2,,,,4,,,,6,29000,TRUE,FALSE,FALSE,2022-12-29
2803,41,168,17,29,,อาวุธปืน ขนาด .45 ยี่ห้อโคลท์,2,,,,4,,,,6,80000,TRUE,FALSE,FALSE,2022-12-29
